{
  "apiVersion": "dashboard.grafana.app/v1",
  "kind": "Dashboard",
  "metadata": {
    "name": "addvzmp"
  },
  "spec": {
    "annotations": {
      "list": [
        {
          "builtIn": 1,
          "datasource": {
            "type": "grafana",
            "uid": "-- Grafana --"
          },
          "enable": true,
          "hide": true,
          "iconColor": "rgba(0, 211, 255, 1)",
          "name": "Annotations & Alerts",
          "type": "dashboard"
        }
      ]
    },
    "description": "Claude Code usage analytics on Prometheus: cost, token consumption, sessions, active coding time, lines of code, commits, pull requests, tool decisions, cache hit ratio, and leaderboards by user, model, and session. Consumes Anthropic's OpenTelemetry metrics via OTLP. Works with Prometheus, VictoriaMetrics, Mimir, and Thanos. Requires Grafana 11+.",
    "editable": true,
    "fiscalYearStartMonth": 0,
    "gnetId": 25255,
    "graphTooltip": 1,
    "links": [
      {
        "asDropdown": false,
        "icon": "external link",
        "includeVars": false,
        "keepTime": false,
        "tags": [],
        "targetBlank": true,
        "title": "Claude Code Documentation",
        "tooltip": "View Claude Code documentation",
        "type": "link",
        "url": "https://docs.anthropic.com/en/docs/claude-code"
      }
    ],
    "liveNow": false,
    "panels": [
      {
        "collapsed": false,
        "gridPos": {
          "h": 1,
          "w": 24,
          "x": 0,
          "y": 0
        },
        "id": 34,
        "title": "Overview",
        "type": "row"
      },
      {
        "datasource": {
          "type": "prometheus",
          "uid": "cfkr3kwq69r7ke"
        },
        "description": "Total number of Claude Code sessions started in the selected time range",
        "fieldConfig": {
          "defaults": {
            "color": {
              "fixedColor": "blue",
              "mode": "fixed"
            },
            "decimals": 0,
            "thresholds": {
              "mode": "absolute",
              "steps": [
                {
                  "color": "blue",
                  "value": 0
                }
              ]
            },
            "unit": "short"
          },
          "overrides": []
        },
        "gridPos": {
          "h": 4,
          "w": 3,
          "x": 0,
          "y": 1
        },
        "id": 2,
        "options": {
          "colorMode": "value",
          "graphMode": "area",
          "justifyMode": "center",
          "orientation": "auto",
          "percentChangeColorMode": "standard",
          "reduceOptions": {
            "calcs": [
              "lastNotNull"
            ],
            "fields": "",
            "values": false
          },
          "showPercentChange": false,
          "textMode": "auto",
          "wideLayout": true
        },
        "pluginVersion": "13.0.1+security-01",
        "targets": [
          {
            "datasource": {
              "type": "prometheus",
              "uid": "cfkr3kwq69r7ke"
            },
            "editorMode": "code",
            "expr": "count(count by (session_id) (max_over_time(claude_code_session_count_total{organization_id=~\"$organization\", user_email=~\"$user\", model=~\"$model\"}[$__range]))) or vector(0)",
            "legendFormat": "Sessions",
            "range": true,
            "refId": "A"
          }
        ],
        "title": "Sessions",
        "type": "stat"
      },
      {
        "datasource": {
          "type": "prometheus",
          "uid": "cfkr3kwq69r7ke"
        },
        "description": "Number of unique users who used Claude Code in the selected time range",
        "fieldConfig": {
          "defaults": {
            "color": {
              "fixedColor": "blue",
              "mode": "fixed"
            },
            "decimals": 0,
            "thresholds": {
              "mode": "absolute",
              "steps": [
                {
                  "color": "blue",
                  "value": 0
                }
              ]
            },
            "unit": "short"
          },
          "overrides": []
        },
        "gridPos": {
          "h": 4,
          "w": 3,
          "x": 3,
          "y": 1
        },
        "id": 3,
        "options": {
          "colorMode": "value",
          "graphMode": "area",
          "justifyMode": "center",
          "orientation": "auto",
          "percentChangeColorMode": "standard",
          "reduceOptions": {
            "calcs": [
              "lastNotNull"
            ],
            "fields": "",
            "values": false
          },
          "showPercentChange": false,
          "textMode": "auto",
          "wideLayout": true
        },
        "pluginVersion": "13.0.1+security-01",
        "targets": [
          {
            "datasource": {
              "type": "prometheus",
              "uid": "cfkr3kwq69r7ke"
            },
            "editorMode": "code",
            "expr": "count(count by (user_email) (max_over_time(claude_code_session_count_total{organization_id=~\"$organization\", user_email=~\"$user\"}[$__range]))) or vector(0)",
            "legendFormat": "Users",
            "range": true,
            "refId": "A"
          }
        ],
        "title": "Users",
        "type": "stat"
      },
      {
        "datasource": {
          "type": "prometheus",
          "uid": "cfkr3kwq69r7ke"
        },
        "description": "Total estimated cost in USD based on token usage and model pricing",
        "fieldConfig": {
          "defaults": {
            "color": {
              "fixedColor": "green",
              "mode": "fixed"
            },
            "decimals": 2,
            "thresholds": {
              "mode": "absolute",
              "steps": [
                {
                  "color": "green",
                  "value": 0
                },
                {
                  "color": "yellow",
                  "value": 100
                },
                {
                  "color": "red",
                  "value": 500
                }
              ]
            },
            "unit": "currencyUSD"
          },
          "overrides": []
        },
        "gridPos": {
          "h": 4,
          "w": 3,
          "x": 6,
          "y": 1
        },
        "id": 4,
        "options": {
          "colorMode": "value",
          "graphMode": "area",
          "justifyMode": "center",
          "orientation": "auto",
          "percentChangeColorMode": "standard",
          "reduceOptions": {
            "calcs": [
              "lastNotNull"
            ],
            "fields": "",
            "values": false
          },
          "showPercentChange": false,
          "textMode": "auto",
          "wideLayout": true
        },
        "pluginVersion": "13.0.1+security-01",
        "targets": [
          {
            "datasource": {
              "type": "prometheus",
              "uid": "cfkr3kwq69r7ke"
            },
            "editorMode": "code",
            "expr": "sum(increase(claude_code_cost_usage_USD_total{organization_id=~\"$organization\", user_email=~\"$user\", model=~\"$model\"}[$__range]))",
            "legendFormat": "Cost",
            "range": true,
            "refId": "A"
          }
        ],
        "title": "Total Cost",
        "type": "stat"
      },
      {
        "datasource": {
          "type": "prometheus",
          "uid": "cfkr3kwq69r7ke"
        },
        "description": "Total tokens consumed including input, output, cache read, and cache creation tokens",
        "fieldConfig": {
          "defaults": {
            "color": {
              "fixedColor": "purple",
              "mode": "fixed"
            },
            "decimals": 0,
            "thresholds": {
              "mode": "absolute",
              "steps": [
                {
                  "color": "purple",
                  "value": 0
                }
              ]
            },
            "unit": "short"
          },
          "overrides": []
        },
        "gridPos": {
          "h": 4,
          "w": 3,
          "x": 9,
          "y": 1
        },
        "id": 5,
        "options": {
          "colorMode": "value",
          "graphMode": "area",
          "justifyMode": "center",
          "orientation": "auto",
          "percentChangeColorMode": "standard",
          "reduceOptions": {
            "calcs": [
              "lastNotNull"
            ],
            "fields": "",
            "values": false
          },
          "showPercentChange": false,
          "textMode": "auto",
          "wideLayout": true
        },
        "pluginVersion": "13.0.1+security-01",
        "targets": [
          {
            "datasource": {
              "type": "prometheus",
              "uid": "cfkr3kwq69r7ke"
            },
            "editorMode": "code",
            "expr": "sum(increase(claude_code_token_usage_tokens_total{organization_id=~\"$organization\", user_email=~\"$user\", model=~\"$model\"}[$__range]))",
            "legendFormat": "Tokens",
            "range": true,
            "refId": "A"
          }
        ],
        "title": "Total Tokens",
        "type": "stat"
      },
      {
        "datasource": {
          "type": "prometheus",
          "uid": "cfkr3kwq69r7ke"
        },
        "description": "Total git commits created using Claude Code",
        "fieldConfig": {
          "defaults": {
            "color": {
              "fixedColor": "orange",
              "mode": "fixed"
            },
            "decimals": 0,
            "thresholds": {
              "mode": "absolute",
              "steps": [
                {
                  "color": "orange",
                  "value": 0
                }
              ]
            },
            "unit": "short"
          },
          "overrides": []
        },
        "gridPos": {
          "h": 4,
          "w": 3,
          "x": 12,